registrant.name,client.name,filing_type_display,income,expenses,filing_year,dt_posted,filing_document_url,registrant.description,client.general_description,filing_type,filing_period,Taxation/Internal Revenue Code
"THE NICKLES GROUP, LLC","NOVO NORDISK, INC.",3rd Quarter - Report,80000.00,NA,2025,2025-10-16T15:48:17-04:00,https://lda.senate.gov/filings/public/filing/fb149e56-a4d7-4565-87d0-d2ba93bdafb5/print/,Consulting firm.,Pharmaceutical company.,Q3,third_quarter,"H.R. 1 (P.L. 119-21), One Big Beautiful Bill Act, as it relates to corporate taxes and foreign-based multinationals. H.R. 591, Defending American Jobs and Investment Act, and H.R. 2423, Unfair Tax Prevention Act, as they relate to multinational corporations."
"TROUTMAN STATEGIES (FKA TROUTMAN PEPPER STRATEGIES, LLC)",LANDRY'S,3rd Quarter - Report,60000.00,NA,2025,2025-10-16T16:51:00-04:00,https://lda.senate.gov/filings/public/filing/6c4a7850-1e84-4b89-a9bf-065ebf324bd8/print/,Lobbying Firm,"Dining, hospitality, entertainment, and gaming corporation.",Q3,third_quarter,Issues related to budget reconciliation and tax policy; H.R.1 - One Big Beautiful Bill Act; advocate to include depreciation and interest to TCJA IRC 163(j) and to increase percentage of deduction; Section 899 and section 871(j).
"BROWNSTEIN HYATT FARBER SCHRECK, LLP",REAL ESTATE ROUNDTABLE,3rd Quarter - Report,70000.00,NA,2025,2025-10-16T19:47:31-04:00,https://lda.senate.gov/filings/public/filing/2b6e88ea-0e41-42a6-84c4-81b798c39188/print/,Law firm,Represent those who own and finance commercial real estate,Q3,third_quarter,Issues related to real estate tax; Business SALT H.R.1 Implantation Section 899 of the Tax Code
"PROLOGIS, L.P.","PROLOGIS, L.P.",3rd Quarter - Report,NA,260000.00,2025,2025-10-17T09:38:11-04:00,https://lda.senate.gov/filings/public/filing/aaeb9e8c-7219-47dc-8277-88d065450b4e/print/,Real estate and logistics,NA,Q3,third_quarter,"H.R. 1, the One Big Beautiful Bill Act, including preservation of the tech-neutral energy investment tax credit (Sec 48E), alternative fuel refueling credit (Sec 30C), and direct pay conversion of energy credits; potential changes to business ""SALT"" tax treatment; and proposed Section 899 provisions addressing unfair foreign taxes; implementation of OBBA including guidance on investment tax credit definitions"
PANASONIC CORPORATION OF NORTH AMERICA (PNA),PANASONIC CORPORATION OF NORTH AMERICA (PNA),3rd Quarter - Report,NA,200000.00,2025,2025-10-17T10:20:58-04:00,https://lda.senate.gov/filings/public/filing/c4ee6ef3-4412-4838-936a-9f89bc70b0b5/print/,NA,NA,Q3,third_quarter,"Issues related to Implementation of Pub. Law No. 117-169, the Inflation Reduction Act of 2022. Issues related H.R. 1, One Big Beautiful Bill Act, specifically provisions related to Section 45X Advanced Manufacturing Production Credit as well as tax credits for clean vehicles (Section 30D new clean vehicles and Section 45W qualified commercial clean vehicles) and international tax provisions (Section 899 the Unfair Foreign Tax Rule)."
"UNILEVER UNITED STATES, INC.","UNILEVER UNITED STATES, INC.",3rd Quarter - Report,NA,110000.00,2025,2025-10-17T11:33:49-04:00,https://lda.senate.gov/filings/public/filing/1729a640-9cf6-40e3-ac67-11a624a14685/print/,Manufacturing; consumer products,NA,Q3,third_quarter,"Sec. 891 / Proposed Sec. 899 - Taxes on Dividends, Royalties an Interest Expense Sec. 59A - US base erosion minimum tax Sec.163(j) and proposed sec. 163(n) - Interest Deduction Limitations"
BOSTON SCIENTIFIC CORPORATION,BOSTON SCIENTIFIC CORPORATION,3rd Quarter - Report,NA,570000.00,2025,2025-10-17T11:42:45-04:00,https://lda.senate.gov/filings/public/filing/866b97fd-9d54-4360-b020-0679947393da/print/,NA,NA,Q3,third_quarter,"OECD 2 Pillar Framework Implementation - International tax provisions specifically regarding the global minimum tax, including the Defending American Jobs Act (H.R. 591) and the Unfair Tax Prevention Act (H.R.2423), legislation regarding extraterritorial taxation. H.R. 1990 American Innovation and R&D Competitiveness Act of 2025. To restore immediate tax deductions for research and development (R&D) expenses, reversing the requirement that companies amortize these costs over several years. H.R. 1 (and Senate Amendment 2360) The One Big Beautiful Bill Act- Maintaining the International Tax regime as established in the 2017 TCJA legislation. Policies include proposed changes to GILTI, specifically Country by Country Reporting, the Section 250 deduction, Roundtripping, Section 899, and to return to pre-2022 R&D expensing rules."
STATE STREET BANK AND TRUST COMPANY AND ITS AFFILIATES,STATE STREET BANK AND TRUST COMPANY AND ITS AFFILIATES,3rd Quarter - Report,NA,240000.00,2025,2025-10-17T12:37:51-04:00,https://lda.senate.gov/filings/public/filing/0cd460e0-b205-4617-821b-6fe9edf79f90/print/,NA,NA,Q3,third_quarter,"Corporate and international tax changes, including Section 899 proposals. Retirement savings incentives. Tax treatment of certain precious metal-backed ETFs."
"THE SMITH-FREE GROUP, LLC",RESOLUTION COPPER MINING LLC,3rd Quarter - Report,30000.00,NA,2025,2025-10-17T14:27:29-04:00,https://lda.senate.gov/filings/public/filing/0c85b51f-cb80-469a-bc2d-88a6e7cf8b4c/print/,Government relations and business consulting,Mining,Q3,third_quarter,Monitored PL 119-21 One Big Beautiful Bill Act; Section 899 and Section 45X
"BROWNSTEIN HYATT FARBER SCHRECK, LLP",AMERICAN GAMING ASSOCIATION,3rd Quarter - Report,30000.00,NA,2025,2025-10-17T14:38:40-04:00,https://lda.senate.gov/filings/public/filing/a51e8df8-58bb-483c-b252-babe9c737f50/print/,Law firm,Represent members' common business issues in areas of federal govt. and legisl. relations,Q3,third_quarter,Introduce bill to amend the internal revenue code of 1986 to repeal the excise taxes on wagering Form W-2G reporting requirements H.R.4304 - Fair Accounting for Income Realized from Betting Earnings Taxation Act H.R.1440 - Discriminatory Gaming Tax Repeal Act of 2025 H.R.2233 - SLOT Act of 2025
INVESTMENT COMPANY INSTITUTE,INVESTMENT COMPANY INSTITUTE,3rd Quarter - Report,NA,1450000.00,2025,2025-10-17T15:05:17-04:00,https://lda.senate.gov/filings/public/filing/afa38541-45bc-4d96-a209-3fd2c6ec28ac/print/,NA,NA,Q3,third_quarter,"S. 1526, Retirement Savings for Americans Act of 2025 S. 1839, Generating Retirement Ownership Through Long-Term Holding (GROWTH) Act H.R. 591, Defending American Jobs and Investment Act / Section 899 H.R. 2089, Generating Retirement Ownership Through Long-Term Holding (GROWTH) Act H.R. 2696, Retirement Savings for Americans Act of 2025 Australia Public Country-by-Country Reporting Municipal bond interest tax exemption Regulated Investment Company asset diversification requirements and good income test Tax deferral of retirement contributions"
ASTRAZENECA PHARMACEUTICALS LP,ASTRAZENECA PHARMACEUTICALS LP,3rd Quarter - Report,NA,1350000.00,2025,2025-10-17T15:06:14-04:00,https://lda.senate.gov/filings/public/filing/c409d98a-9d8d-4c4b-83af-22620fba9ca4/print/,NA,NA,Q3,third_quarter,"Implementation of One Big Beautiful Bill Act law (corporate minimum tax, R&D expensing) HR 591 - Defending American Jobs and Investment Act HR 1414 - Camerons Law, to restore orphan drug research tax credit HR 1990 - American Innovation and R&D Competitiveness Act of 2025 HR 2423 - Unfair Tax Prevention Act S 1605 - International Competition for American Jobs Act Tax reform in budget reconciliation and Byrd rules Section 899 tax proposal Interaction of state and federal R&D credits Expiring provisions of the Tax Cut and Jobs Act law - deduction of research and development expenditures Issues related to international tax rules (GILTI/FDII/BEAT) Issues related to the renewable energy tax credits and other energy credits included in the Inflation Reduction Act Expiring provisions of the Tax Cut and Jobs Act law - deduction of research and development expenditures Education on tax in preparation for 2025 tax legislation"
"SMBC AMERICAS HOLDINGS, INC.","SMBC AMERICAS HOLDINGS, INC.",3rd Quarter - Report,NA,550000.00,2025,2025-10-17T16:54:47-04:00,https://lda.senate.gov/filings/public/filing/4c162eb9-bc66-420a-ab69-5f0c1b51524c/print/,NA,Financial Services Company,Q3,third_quarter,"Domestic and International Taxation as it Applies to Financial Institutions. H.R. 1 - Section 899, regarding unfair foreign taxes."
SEMICONDUCTOR INDUSTRY ASSOCIATION,SEMICONDUCTOR INDUSTRY ASSOCIATION,3rd Quarter - Report,NA,420000.00,2025,2025-10-17T17:30:13-04:00,https://lda.senate.gov/filings/public/filing/a8cc042a-b688-41a6-9ac3-132618b11353/print/,NA,NA,Q3,third_quarter,"American Innovation and R&D Competitiveness Act (H.R. 1990). Policy issues related to the implementation of the CHIPS and Science Act (P.L.117-167) advanced manufacturing investment credit; tax policy issues related to incentivizing semiconductor manufacturing, research and development, and design activities, United States-Taiwan Expedited Double-Tax Relief Act (S. 199 and H.R. 33). Semiconductor Technology Advancement and Research (STAR) Act (H.R. 802), extension of business provisions Tax Cuts and Jobs Act (TCJA) (P.L. 115-97) including Foreign Derived Intangible Income (FDII) and immediate deduction of R&D expenses under IRC section 174. All sections under the Building Advanced Semiconductors Investment Credit (BASIC) Act (H.R. 3204); all sections under the One Big Beautiful Bill Act (P.L. 119-21) pertaining to an extension, expansion, and increase in the rate of the advanced manufacturing investment credit and matters related to foreign entities of concern under IRC section 45Y and 48E, IRC section 174 expensing, Foreign-Derived Deduction Eligible Income (formerly FDII), proposed IRC section 899 on remedies against unfair foreign taxes, IRC section 163(j), and other business expensing matters."
"BROWNSTEIN HYATT FARBER SCHRECK, LLP","CAESARS ENTERPRISE SERVICES, LLC",3rd Quarter - Report,90000.00,NA,2025,2025-10-17T19:37:27-04:00,https://lda.senate.gov/filings/public/filing/1965637f-6350-4103-810f-ead4df222d5a/print/,Law firm,Gaming,Q3,third_quarter,Issues relating to the gaming industry including taxation Reconciliation provision relating to new proposed new section 899 of the Tax Code H.R.4304 - Fair Accounting for Income Realized from Betting Earnings Taxation Act
ENTERTAINMENT SOFTWARE ASSOCIATION,ENTERTAINMENT SOFTWARE ASSOCIATION,3rd Quarter - Report,NA,1290000.00,2025,2025-10-18T00:56:56-04:00,https://lda.senate.gov/filings/public/filing/2df88fed-a2da-4428-b1c3-d6438886dadf/print/,NA,NA,Q3,third_quarter,Monitored and advocated for H.R. 1 -- the One Big Beautiful Bill Act; Monitored H.R. 2423 -- the Unfair Tax Prevention Act.
AMERICAN SENIORS HOUSING ASSOCIATION,AMERICAN SENIORS HOUSING ASSOCIATION,3rd Quarter - Report,NA,75000.00,2025,2025-10-18T09:46:11-04:00,https://lda.senate.gov/filings/public/filing/a661ed9d-2307-4f48-9d5a-531aae910058/print/,seniors housing trade association,NA,Q3,third_quarter,"- H.R. 1177 - Improve and Enhance the Work Opportunity Tax Credit Act - H.R. 2410 - Revitalizing Downtowns and Main Streets Act - Incentivize Adaptive Reuse of Underutilized Commercial Properties - H.R. 2036 / S. 925 - Credit for Caring Act - H.R. 2082 - Well-Being Insurance for Seniors to be at Home (WISH) Act - H.R. 1321 - More Homes on the Market Act - Preservation of Carried Interest Tax Treatment - Preservation of Full Deductibility of Business-Related Property Taxes (B-SALT) - Section 199A of Internal Revenue Code - Deduction for Qualified Business Income (QBI) in Assisted Living Residence - H.R.1 - One Big Beautiful Bill Act - Section 899, Enforcement of Remedies Against Unfair Foreign Taxes of the House passed Budget Reconciliation bill to exempt non-controlling investments in U.S. real estate, regardless of whether those investments are made through equity or debt"
"CROSSROADS STRATEGIES, LLC","EISAI, INC.",3rd Quarter - Report,50000.00,NA,2025,2025-10-18T16:58:40-04:00,https://lda.senate.gov/filings/public/filing/73b87ce2-faa0-4b01-81a3-f5141d4acd66/print/,lobbying firm,human health care company,Q3,third_quarter,"Issues related to tax reform; R&D tax credit; Section 899; H.R.1, One Big Beautiful Bill Act (P.L.119-21)."
"CROSSROADS STRATEGIES, LLC",SANOFI US SERVICES INC.,3rd Quarter - Report,50000.00,NA,2025,2025-10-18T23:56:33-04:00,https://lda.senate.gov/filings/public/filing/a3598f73-d3df-44ea-a88f-7560bff471eb/print/,lobbying firm,pharmaceutical manufacturer,Q3,third_quarter,"Issues related to tax reform; R&D tax credit; international taxation; Inflation Reduction Act of 2022 (P.L.117-169) implementation; Section 899; H.R.1, One Big Beautiful Bill Act (P.L.119-21)."
"LG ELECTRONICS U.S.A., INC.","LG ELECTRONICS U.S.A., INC.",3rd Quarter - Report,NA,400000.00,2025,2025-10-19T09:58:36-04:00,https://lda.senate.gov/filings/public/filing/0e3b3399-7296-4b1b-b0cc-bdf55c9811f7/print/,NA,"Electronics, appliances, and related services.",Q3,third_quarter,"Policies related to electric vehicles, battery manufacturing, and the supply chain; International tax provisions in the One Big Beautiful Bill Act (P.L. 119-21), including Section 899."
"CROSSROADS STRATEGIES, LLC","NISSAN NORTH AMERICA, INC.",3rd Quarter - Report,80000.00,NA,2025,2025-10-19T10:19:33-04:00,https://lda.senate.gov/filings/public/filing/d5033b9a-6439-4242-bcce-b5297c7640a0/print/,lobbying firm,automobile manufacturer,Q3,third_quarter,"Vehicle-related Tax Deduction/Credit Discussion; Section 899; H.R.1, One Big Beautiful Bill Act (P.L.119-21)."
WINNING STRATEGIES WASHINGTON,"PROLOGIS, L.P.",3rd Quarter - Report,30000.00,NA,2025,2025-10-19T16:52:41-04:00,https://lda.senate.gov/filings/public/filing/e6951d8a-c758-4779-8bdc-dbba492e1937/print/,Government relations firm,"Real Estate, Warehousing and Logistics",Q3,third_quarter,"H.R. 1, the One Big Beautiful Bill Act, including preservation of the tech-neutral energy investment tax credit (Sec 48E), alternative fuel refueling credit (Sec 30C), and direct pay conversion of energy credits; potential changes to business ""SALT"" tax treatment; and proposed section 899 provisions addressing unfair foreign taxes; implementation of OBBBA, including guidance on investment tax credit definitions"
OGR,GLOBAL BUSINESS ALLIANCE,3rd Quarter - Report,50000.00,NA,2025,2025-10-19T18:39:41-04:00,https://lda.senate.gov/filings/public/filing/6a252f09-8f25-48e4-a6bc-ceb49256f96f/print/,lobbying firm,non-profit business association,Q3,third_quarter,"Issues related to OECD International Tax Agreement; H.R.591, Defending American Jobs and Investment Act; H.R.2423, Unfair Tax Prevention Act. Issues related to extension of the Tax Cuts and Jobs Act (P.L.115-97); H.R.1, One Big Beautiful Bill Act (P.L.119-21). Issues related to the Halting International Relocation of Employment (HIRE) Act (draft proposal)."
OGR,"ASML US, LLC",3rd Quarter - Report,70000.00,NA,2025,2025-10-19T22:19:28-04:00,https://lda.senate.gov/filings/public/filing/f3eab355-f4c1-49eb-aa0b-91b5c8159437/print/,lobbying firm,semiconductor equipment manufacturing,Q3,third_quarter,"Issues related to international taxation; H.R.33/S.199, United States-Taiwan Expedited Double-Tax Relief Act; H.R.1, One Big Beautiful Bill Act (P.L.119-21); H.R.591, Defending American Jobs and Investment Act; H.R.2423, Unfair Tax Prevention Act."
ERNST & YOUNG LLP (WASHINGTON COUNCIL ERNST & YOUNG),ANHEUSER-BUSCH COMPANIES,3rd Quarter - Termination,60000.00,NA,2025,2025-10-19T23:01:51-04:00,https://lda.senate.gov/filings/public/filing/b60d3cff-b3d6-43a9-8410-6ad793f0d010/print/,Professional services firm,Alcoholic beverage producer and distributor,3T,third_quarter,"General business tax issues, Section 899, IRC Section 163(j), and domestic manufacturing incentives in Title VII of H.R. 1, the One Big, Beautiful Bill Act (budget reconciliation bill, P.L. 119-21)"
ERNST & YOUNG LLP (WASHINGTON COUNCIL ERNST & YOUNG),NATIONAL ASSOCIATION OF REAL ESTATE INVESTMENT TRUSTS,3rd Quarter - Report,60000.00,NA,2025,2025-10-19T23:37:38-04:00,https://lda.senate.gov/filings/public/filing/760a2bb8-6d30-4e9a-a1c1-8e3a16dbad4b/print/,Professional services firm,NA,Q3,third_quarter,"- Proposed limits on C-SALT deduction (Corporate State and Local Taxes) and proposed section 899 in H.R. 1, the One Big, Beautiful Bill Act (budget reconciliation bill, P.L. 119-21)"
ERNST & YOUNG LLP (WASHINGTON COUNCIL ERNST & YOUNG),SAP AMERICA,3rd Quarter - Report,NA,NA,2025,2025-10-19T23:49:25-04:00,https://lda.senate.gov/filings/public/filing/ec8acb4c-dfab-4d90-8ea3-543aabd7a602/print/,Professional services firm,Producer of software for business management processes,Q3,third_quarter,"Base Erosion and Anti-Abuse Tax (BEAT) and Section 899 in Title VII of H.R. 1, the One Big, Beautiful Bill Act (budget reconciliation bill, P.L. 119-21)"
"BNP PARIBAS RCC, INC.","BNP PARIBAS RCC, INC.",3rd Quarter - Report,NA,40000.00,2025,2025-10-20T09:31:22-04:00,https://lda.senate.gov/filings/public/filing/102df503-2410-49ab-9d08-d9145f1158dc/print/,Financial Services,NA,Q3,third_quarter,"General discussions related to H.R. 1, the One Big Beautiful Bill Act including, Section 899, international tax policy, and energy tax credits."
"CROSSROADS STRATEGIES, LLC","TAKEDA PHARMACEUTICALS AMERICA, INC.",3rd Quarter - Report,50000.00,NA,2025,2025-10-20T09:38:38-04:00,https://lda.senate.gov/filings/public/filing/2c3fdea0-53f3-40a2-8ae3-d63111d06e40/print/,lobbying firm,pharmaceutical company,Q3,third_quarter,"Issues related to tax reform; R&D tax credit; orphan drug tax credit; Inflation Reduction Act of 2022 (P.L.117-169) implementation; Section 899; H.R.1, One Big Beautiful Bill Act (P.L.119-21)."
BASF CORPORATION,BASF CORPORATION,3rd Quarter - Report,NA,710000.00,2025,2025-10-20T10:16:49-04:00,https://lda.senate.gov/filings/public/filing/9fae9448-fbb8-48c5-8b0e-8dff9f6bd7a2/print/,NA,NA,Q3,third_quarter,"H.R.1 - One Big Beautiful Bill Act implementation. BASF supports policies that encourage energy efficiency, including IRC Sec. 25C, and opposes the proposed IRC Sec. 899."
VENN STRATEGIES,ALLIANZ,3rd Quarter - Report,50000.00,NA,2025,2025-10-20T10:50:02-04:00,https://lda.senate.gov/filings/public/filing/0f75cbd0-d7d7-41cd-86a2-6214acb56e42/print/,A political and public affairs consulting firm.,Insurance,Q3,third_quarter,"International tax issues in H.R. 1, including the proposed Sec. 899 and the Base Erosion and Anti-Abuse Tax (BEAT)., International tax issues in H.R. 1, including the proposed Sec. 899 and the Base Erosion and Anti-Abuse Tax (BEAT)."
ALSTON & BIRD LLP,"BIOMERIEUX, INC.",3rd Quarter - Report,70000.00,NA,2025,2025-10-20T10:56:17-04:00,https://lda.senate.gov/filings/public/filing/1a923a3a-f4a9-409c-b3ba-313fadf234c0/print/,Law Firm,Global in vitro diagnostics company.,Q3,third_quarter,"Pub. L. No. 119-21, One Big Beautiful Bill Act of 2025, provisions relating to Section 899 of U.S. Tax Code., Pub. L. No. 119-21, One Big Beautiful Bill Act of 2025, provisions relating to Section 899 of U.S. Tax Code."
WGL,WASHINGTON GAS LIGHT COMPANY,3rd Quarter - Report,NA,300000.00,2025,2025-10-20T11:38:39-04:00,https://lda.senate.gov/filings/public/filing/56a5716f-9d04-4921-a384-c02390d980dd/print/,utilities,utilities and energy,Q3,third_quarter,Miscellaneous Corporate Tax Matters Retaining a low corporate tax rate Preserving corporate SALT deduction Parity for capital gains and dividends section 899 revenge tax provision Tariffs Impacts of tariffs on consumer energy bills
EISAI INC.,EISAI INC.,3rd Quarter - Report,NA,620000.00,2025,2025-10-20T12:00:42-04:00,https://lda.senate.gov/filings/public/filing/ef97ac67-0d60-4858-b876-a6635509526e/print/,"Pharmaceutical development, manufacturing and distribution -- Health Care",NA,Q3,third_quarter,"Issues related to tax reform. Research and Development tax credit; Section 899; H.R.1, One Big Beautiful Bill Act."
COVESTRO LLC,COVESTRO LLC,3rd Quarter - Report,NA,310000.00,2025,2025-10-20T12:21:27-04:00,https://lda.senate.gov/filings/public/filing/f1227676-4304-4788-9cd8-685dc2dca555/print/,Chemical manufacturing company.,NA,Q3,third_quarter,"Outreach and monitoring related to: -Legislative and administrative action regarding the preservation of energy tax credits (Sections 25C 45Q, 45V, 48C); -One Big Beautiful Bill (PL 119-21) - Legislative and administrative action regarding Section 899; -Legislative and administrative action regarding economic investment credits."
LYONDELL CHEMICAL COMPANY,LYONDELL CHEMICAL COMPANY,3rd Quarter - Report,NA,690000.00,2025,2025-10-20T12:45:11-04:00,https://lda.senate.gov/filings/public/filing/38dfd60e-5d4d-4746-a95d-e3efacee7db4/print/,NA,NA,Q3,third_quarter,"H.R. 1 - One Big Beautiful Bill Act (Public Law 119-106); Section 899, 45Q Credit for carbon oxide sequestration, 45V Credit for production of clean hydrogen, 48 Qualifying advanced energy project credit. Infrastructure Investment and Jobs Act (Public Law 117-58); Reinstatement of superfund excise tax on chemicals as a funding mechanism; Implementation. Inflation Reduction Act of 2022 (Public Law 117-169); Incentives for Industrial Decarbonization including Clean Energy Development and Carbon Capture, Utilization, and Storage; Implementation. Tax Cuts and Jobs Act (Public Law 115-97); Expiring provisions H.R.591 - Defending American Jobs and Investment Act Chemical Tax Repeal Act (S.615) Recycling infrastructure tax credit (not yet introduced)"
RHEEM MANUFACTURING COMPANY,RHEEM MANUFACTURING COMPANY,3rd Quarter - Report,NA,80000.00,2025,2025-10-20T13:45:30-04:00,https://lda.senate.gov/filings/public/filing/fb57ac46-43bb-40d7-ad2c-616ef54c684e/print/,"Manufactuirng of water heating, heating, and air conditioning equipment",NA,Q3,third_quarter,"Public Law 119-21 (H.R.1 The Big Beautiful Bill Act of 2025); Section 899; Enforcement of Remedies Against Unfair Foreign Taxes Public Law 119-21 (H.R.1 The Big Beautiful Bill Act of 2025); Research and Development Expensing, Capital Equipment Expensing) Public Law 119-21 (H.R.1 The Big Beautiful Bill Act of 2025); 45L New Home Energy Efficient Tax Credit"
"FUTURE STANDARD (FORMERLY FRANKLIN SQUARE HOLDINGS, L.P.)","FUTURE STANDARD (FORMERLY FRANKLIN SQUARE HOLDINGS, L.P.)",3rd Quarter - Report,NA,140000.00,2025,2025-10-20T13:54:31-04:00,https://lda.senate.gov/filings/public/filing/5e606c0a-66fb-46db-b309-f0483036fcaf/print/,Investment management.,NA,Q3,third_quarter,"H.R. 652, Small Business Investor Tax Parity Act of 2025, all provisions. H.R. 703 and S. 213, Main Street Tax Certainty Act, provisions related to REITs. H.R. 1, One, Big Beautiful Bill, Provisions related to Section 199A for REITs and BDCs; Section 899."
"BMW OF NORTH AMERICA, LLC","BMW OF NORTH AMERICA, LLC",3rd Quarter - Report,NA,260000.00,2025,2025-10-20T14:15:33-04:00,https://lda.senate.gov/filings/public/filing/772cb775-45eb-4365-8fa0-bb762eb2b209/print/,"Manufacturing, Sales and Marketing of Automobiles",NA,Q3,third_quarter,"H.R.1 - One Big Beautiful Bill Act- in specific to 30d and 45w- electric vehicle credits (section 70502 and 70503), 45x- Advanced Manufacturing Production Credit (section 70514), Enforcement of Remedies Against Unfair Foreign Taxes- Section 899, and Section 401(h) pension reform."
"DPWN HOLDINGS (USA) INC. (FORMERLY KNOWN AS DEUTSCHE POST WORLD NET USA, INC.)","DPWN HOLDINGS (USA) INC. (FORMERLY KNOWN AS DEUTSCHE POST WORLD NET-USA, INC.)",3rd Quarter - Report,NA,50000.00,2025,2025-10-20T14:31:03-04:00,https://lda.senate.gov/filings/public/filing/34a38ee9-dbb9-4dbe-9142-2e9035ff445f/print/,Transportation and supply chain logistics.,NA,Q3,third_quarter,"HR 1. One Big Beautiful Bill-Issues related to the expiring provisions of the Tax Cuts and Jobs Act (Base Erosion and Anti-Abuse Tax Sec 899. Provisions related to de minimis clearance and the Inflation Reduction Act provisions related to electric vehicles, charging, sustainable aviation fuels, and bio-fuels.) Implementation of the One Big Beautiful Bill. Operations related to the discontinuance of the de minimis clearance and the impact on commercial and postal shipments."
"MIZUHO BANK, LTD.","MIZUHO BANK, LTD.",3rd Quarter - Report,NA,30000.00,2025,2025-10-20T14:37:48-04:00,https://lda.senate.gov/filings/public/filing/d44678ec-8edf-45d6-8aa9-138d02022ed6/print/,Financial Institution,NA,Q3,third_quarter,Discussion related to Section 899 of H.R. 1 - One Big Beautiful Bill Act.
"SMITH & NEPHEW, INC.","SMITH & NEPHEW, INC.",3rd Quarter - Report,NA,350000.00,2025,2025-10-20T14:40:08-04:00,https://lda.senate.gov/filings/public/filing/ce4edc6c-6e8f-47d0-851a-85e58a9c8d17/print/,Manufacturer of medical devices and biologics,NA,Q3,third_quarter,"Issues related to the base erosion and anti-abuse tax. Section 899 of the One Big Beautiful Bill Act, H.R.1."
"SAMSUNG SDI AMERICA, INC.","SAMSUNG SDI AMERICA, INC.",3rd Quarter - Report,NA,200000.00,2025,2025-10-20T14:54:23-04:00,https://lda.senate.gov/filings/public/filing/c84b40be-4bfd-489f-9c3a-f1833a4cf794/print/,NA,Manufacturer of battery technology and energy storage.,Q3,third_quarter,"Implementation and preservation of IRA Sections 30D and 45X. Implementation and preservation of credit on ESS battery storage. H.R. 1, One Big Beautiful Bill Act, provisions on energy taxes, section 899, R&D tax permanency, and immediate expensing. Implementation of the OBBBA (Pub. L. No. 119-21), including tax regulations., Implementation and preservation of IRA Sections 30D and 45X. Implementation and preservation of credit on ESS battery storage. H.R. 1, One Big Beautiful Bill Act, provisions on energy taxes, section 899, R&D tax permanency, and immediate expensing. Implementation of the OBBBA (Pub. L. No. 119-21), including tax regulations."
