registrant.name,client.name,filing_type_display,income,expenses,filing_year,dt_posted,filing_document_url,registrant.description,client.general_description,filing_type,filing_period,Taxation/Internal Revenue Code
"THE NICKLES GROUP, LLC","NOVO NORDISK, INC.",1st Quarter - Report,80000.00,NA,2025,2025-04-17T12:40:51-04:00,https://lda.senate.gov/filings/public/filing/f04183f7-2ec8-4416-8255-1db306d1c3d1/print/,Consulting firm.,Pharmaceutical company.,Q1,first_quarter,"Issues related to the extension of the Tax Cut and Jobs Act provisions impacting corporations. H.R. 591, Defending American Jobs and Investment Act, and H.R. 2423, Unfair Tax Prevention Act, as they relate to multinational corporations."
BOSTON SCIENTIFIC CORPORATION,BOSTON SCIENTIFIC CORPORATION,1st Quarter - Report,NA,400000.00,2025,2025-04-17T13:57:14-04:00,https://lda.senate.gov/filings/public/filing/4af6d8b8-46b0-4023-baf2-22323d9f3a54/print/,NA,NA,Q1,first_quarter,"OECD 2 Pillar Framework Implementation - International tax provisions specifically regarding the global minimum tax, including the Defending American Jobs Act (H.R. 591) and the Unfair Tax Prevention Act (H.R.2423), legislation regarding extraterritorial taxation. H.R. 1990 American Innovation and R&D Competitiveness Act of 2025 - advocacy for legislation to return to pre-2022 R&D expensing rules. TCJA Reauthorization - Maintaining the International Tax regime as established in the 2017 TCJA legislation. Policies include proposed changes to GILTI, specifically Country by Country Reporting, and the Section 250 deduction."
"UNILEVER UNITED STATES, INC.","UNILEVER UNITED STATES, INC.",1st Quarter - Report,NA,50000.00,2025,2025-04-17T15:03:28-04:00,https://lda.senate.gov/filings/public/filing/e2715ed8-431b-45e0-b1d0-a6925eccf53b/print/,Manufacturing; consumer products,NA,Q1,first_quarter,"Sec. 891 / Proposed Sec. 899 - Taxes on Dividends, Royalties an Interest Expense Sec. 59A - US base erosion minimum tax Sec.163(j) and proposed sec. 163(n) - Interest Deduction Limitations Defending American Jobs and Investment Act (H.R. 591) Unfair Tax Prevention Act (H.R. 2423)"
THE GOODYEAR TIRE & RUBBER COMPANY,GOODYEAR TIRE & RUBBER COMPANY,1st Quarter - Report,NA,870000.00,2025,2025-04-17T16:57:32-04:00,https://lda.senate.gov/filings/public/filing/1fd2673f-b620-4173-a959-c17a168edb63/print/,NA,NA,Q1,first_quarter,"Formulation of legislative provisions regarding R&D expensing, interest expense limitation, and bonus depreciation (no bill). Formulation of legislative proposals regarding commercial vehicle retreaded tire utilization (no bill). H.R.2423, Unfair Tax Prevention Act, all provisions"
TIBER CREEK GROUP,MUNICH AMERICAN REASSURANCE COMPANY,1st Quarter - Report,20000.00,NA,2025,2025-04-18T14:22:56-04:00,https://lda.senate.gov/filings/public/filing/a5677b3d-ec14-4511-9826-74cc72dd1a90/print/,Government Relations.,Reinsurance company.,Q1,first_quarter,Advocating for appropriate tax treatment of reinsurance transactions; H.R. 4695 - Unfair Tax Prevention Act.
"THE NICKLES GROUP, LLC","UCB, INC.",1st Quarter - Report,60000.00,NA,2025,2025-04-21T11:03:34-04:00,https://lda.senate.gov/filings/public/filing/371d88ab-0396-4dd1-a82d-924140978884/print/,Consulting firm.,Biopharmaceutical company,Q1,first_quarter,"H.R. 1990, the American Innovation and R&D Competitiveness Act, as it relates to the R&D tax credit. Monitored H.R. 591, Defending American Jobs & Investment Act and H.R. 2423, Unfair Tax Prevention Act, as they relate to taxation of foreign-based multinationals. Issues related to the 2025 extension of the Tax Cut and Jobs Act provisions impacting corporations and the Orphan Drug Tax Credit."
NOVARTIS,NOVARTIS,1st Quarter - Report,NA,4168000.00,2025,2025-04-21T12:42:05-04:00,https://lda.senate.gov/filings/public/filing/9f1ac4b8-2ac6-4260-a2bc-005a7fc5ac7c/print/,Federal Government Relations/Legislative Affairs,NA,Q1,first_quarter,"Domestic and International Tax Policy Issues Research & Development Tax Credit Reforms Tax Relief for American Families and Workers Act Foreign Direct Investment Expensing of R&D Expenditures H.R. 2425 - Unfair Tax Prevention Act of 2025 Tax Cuts and Jobs Act, PL 115-97"
"TOYOTA MOTOR NORTH AMERICA, INC. (TMA)",TOYOTA MOTOR NORTH AMERICA INC (TMA),1st Quarter - Report,NA,1235360.00,2025,2025-04-21T13:54:57-04:00,https://lda.senate.gov/filings/public/filing/04c5d722-18c0-44ba-85a1-88bf5a3ee588/print/,NA,NA,Q1,first_quarter,International tax matters related to inbound and outbound investments and a global minimum tax; taxation matters related to the corporate tax rate. The Build It in America Act (H.R. 3938) The Defending American Jobs and Investment Act (H.R. 3665) The Unfair Tax Prevention Act (H.R. 4695)
GLOBAL BUSINESS ALLIANCE,GLOBAL BUSINESS ALLIANCE,1st Quarter - Report,NA,340000.00,2025,2025-04-21T14:23:46-04:00,https://lda.senate.gov/filings/public/filing/f9e056a1-3251-409d-ab5e-138a1d0929de/print/,NA,NA,Q1,first_quarter,Issues relating to corporate tax reform's impact on the competitiveness of the United States as a location for foreign direct investment. Issues related to guidance and implementation of certain provisions in the Inflation Reduction Act including the new stock buyback excise tax and corporate AMT provisions. Issues related to alignment with the OECD relating to a 15% global rate and other OECD developments. Issues relating to 163(j) changes effective in 2022. Issues relating to Section 174 the Research & Development expensing. Issues relating to upcoming changes to Section 168(k) bonus depreciation. Issues relating to the Tax Relief for American Families and Workers Act (H.R. 7024) Issues relating to the Unfair Tax Prevention Act (H.R. 2423)
ASTRAZENECA PHARMACEUTICALS LP,ASTRAZENECA PHARMACEUTICALS LP,1st Quarter - Report,NA,1240000.00,2025,2025-04-21T15:00:06-04:00,https://lda.senate.gov/filings/public/filing/a43c85d9-4b63-49c4-b7e8-6ed2582b07b1/print/,NA,NA,Q1,first_quarter,"H.R.591 - Defending American Jobs and Investment Act HR 1414 - Cameron's Law, to restore orphan drug research tax credit H.R.1990 - American Innovation and R&D Competitiveness Act of 2025 H.R.4695 - Unfair Tax Prevention Act Expiring provisions of the Tax Cut and Jobs Act law Tax reform in budget reconciliation Trade and tariffs (general education, country-specific tariffs, sector-specific tariffs) pharmaceutical manufacturing (general education) Issues related to tariffs Issues related to the deduction of research and development expenditures Education on tax in preparation for 2025 tax legislation"
"THE NICKLES GROUP, LLC",CSL BEHRING LLC,1st Quarter - Report,50000.00,NA,2025,2025-04-21T16:25:31-04:00,https://lda.senate.gov/filings/public/filing/fb28483a-f1e2-4021-8515-35a0b50e04b0/print/,Consulting firm.,Biotherapeutic company providing recombinant and plasma-derived products.,Q1,first_quarter,"H.R. 1990, the American Innovation and R&D Competitiveness Act, as it relates to the R&D tax credit. Monitored H.R. 591, Defending American Jobs & Investment Act and H.R. 2423, Unfair Tax Prevention Act, as they relate to taxation of foreign-based multinationals. Issues related to the 2025 extension of the Tax Cut and Jobs Act provisions impacting corporations and the Orphan Drug Tax Credit."
FARM CREDIT COUNCIL,FARM CREDIT COUNCIL,1st Quarter - Report,NA,140000.00,2025,2025-04-21T17:48:03-04:00,https://lda.senate.gov/filings/public/filing/ac5efcb1-d36a-4c01-9d40-a202ffe2e512/print/,Government affairs support for agricultural finance trade association.,NA,Q1,first_quarter,TCJA Expiration
"RBC CAPITAL MARKETS, LLC","RBC CAPITAL MARKETS, LLC",1st Quarter - Amendment,NA,270000.00,2025,2025-05-02T15:51:51-04:00,https://lda.senate.gov/filings/public/filing/b248e7d7-51f4-4a4f-9758-f4845e17af03/print/,Financial Services,NA,1A,first_quarter,"Issues related to tax reform, including the Low-Income Housing Tax Credit (LIHTC), infrastructure finance, and revisions to international tax policy. H.R. 2423: Unfair Tax Prevention Act H.R. 591: Defending American Jobs and Investment Act"
"RBC CAPITAL MARKETS, LLC","RBC CAPITAL MARKETS, LLC",1st Quarter - Amendment,NA,270000.00,2025,2025-05-02T15:59:12-04:00,https://lda.senate.gov/filings/public/filing/32a38569-b0f4-4304-b896-88eba8538eac/print/,Financial Services,NA,1A,first_quarter,"Issues related to tax reform, including the Low-Income Housing Tax Credit (LIHTC), infrastructure finance, and revisions to international tax policy. H.R. 2423: Unfair Tax Prevention Act H.R. 591: Defending American Jobs and Investment Act"
MR. RICHARD BURNESS,BROWNSTEIN HYATT FARBER SCHRECK LLP OBO AXA XL,Registration,NA,NA,2025,2025-07-05T16:11:52-04:00,https://lda.senate.gov/filings/public/filing/2a60015f-72a8-4600-9990-ca487272f593/print/,Tax consulting and lobbying,Law firm,RR,second_quarter,International tax matters including proposed section 899
MR. RICHARD BURNESS,BROWNSTEIN HYATT FARBER SCHRECK LLP OBO AXA XL,2nd Quarter - Report,NA,NA,2025,2025-07-07T14:24:03-04:00,https://lda.senate.gov/filings/public/filing/69d0486a-ecef-440e-83ea-0190644c0e17/print/,Tax consulting and lobbying,Law firm,Q2,second_quarter,OBBBA Section 899
"SYENSQO USA LLC F/K/A SOLVAY AMERICA LLC, A MEMBER OF THE SYENSQO GROUP","SYENSQO USA LLC F/K/A SOLVAY AMERICA LLC, A MEMBER OF THE SYENSQO GROUP",2nd Quarter - Report,NA,220000.00,2025,2025-07-08T09:40:55-04:00,https://lda.senate.gov/filings/public/filing/4fa7d1e8-065b-408a-8203-e3dfe529ce20/print/,"Solvay manufactures an extensive range of chemicals and plastics such as soda ash, etc.",NA,Q2,second_quarter,"H.R. 1, One Big Beautiful Bill Act, including provisions related to clean energy tax credits and corporate tax modifications for US subsidiaries subject to foreign extraterritorial tax regimes. Department of Treasury's final regulations for the Section 30D New Clean Vehicle Credit (IRS-2023-0019) (Mar. 31, 2023), including provisions related to Critical Mineral and Battery Component Value Calculations, guidance on Foreign Entities of Concern prohibitions, and Department of Energy's final regulations on interpretation of Foreign Entity of Concern (DOE-2023-26513). Department of Treasury's final regulations for the Energy Security Tax Credits under Sections 48C and 45X (IRS-2022-0047) (Nov. 4, 2022), including provisions related to Critical Mineral and Battery Component Value Calculations, and guidance on Foreign Entities of Concern prohibitions. H.R. 591, Defending American Jobs and Investment Act, including provisions related to Undertaxed Profits Rule (UTPR), OECD Pillars I and II, and international tax provisions. H.R. 2423, the Unfair Tax Prevention Act, including provisions related to changes to the Base Erosion and Anti Abuse Tax. H.R. 640, The Chemical Tax Repeal Act, including provisions related to repealing 2021 Superfund excise taxes. S. 541, Eliminating Lavish Incentives to Electric Vehicles Act, including provisions related to the repeal of tax credits for clean vehicles."
"ADVANCED POLICY CONSULTING, LLC",INVESTMENT COMPANY INSTITUTE (ICI),2nd Quarter - Report,20000.00,NA,2025,2025-07-08T12:48:12-04:00,https://lda.senate.gov/filings/public/filing/269a8499-1c57-4d67-9a78-1e089fc8fb0d/print/,Consulting,The national association of U.S. investment companies.,Q2,second_quarter,Monitoring changes to the tax code as it pertain to retirement savings. Support tax deferral of retirement plan contributions. Support keeping the rates for capital gains and dividends at the preferential tax rate. Oppose financial transaction tax proposals. Support private retirement system for saving. Reconciliation legislation -- One Big Beautiful Bill Act (H.R. 1) as it relates to Section 899.
VENABLE LLP,FCA US LLC,2nd Quarter - Report,50000.00,NA,2025,2025-07-08T16:51:36-04:00,https://lda.senate.gov/filings/public/filing/3da18c7a-f589-4ab4-9985-fab4cef9e953/print/,Law firm,Automotive manufacturing,Q2,second_quarter,"Electric vehicle credit provisions and related Treasury and IRS guidance (pertaining to Sections 25E, 30D, 45X, 45W, 6417 and 6418) in P.L. No. 117-169; Section 174 treatment and 100% bonus depreciation in H.R. 7024, The Tax Relief for American Families and Workers Act of 2024; Proposed section 899 and proposals regarding BEAT, GILTI, and FDII rules in House and Senate versions of H.R. 1"
"ABB, INC.","ABB, INC.",2nd Quarter - Report,NA,150000.00,2025,2025-07-15T11:39:06-04:00,https://lda.senate.gov/filings/public/filing/b735190b-179d-4b7a-8e59-cca1c1d02e4c/print/,NA,NA,Q2,second_quarter,"H.R. 1 (OBBBA) - Energy and manufacturing tax incentives (incl. transferability, FEOC), Section 899"
WGL,WASHINGTON GAS LIGHT COMPANY,2nd Quarter - Report,NA,120000.00,2025,2025-07-15T12:43:12-04:00,https://lda.senate.gov/filings/public/filing/c0e782b5-773b-46d6-b688-8c2329ac67aa/print/,utilities,utilities and energy,Q2,second_quarter,HR 1 Budget Reconciliation Corporate Tax rate Section 45V Clean Hydrogen Production Tax Credit implementation Section 48 Investment Tax Credit implementation Miscellaneous Corporate Tax Matters Retaining a low corporate tax rate Preserving corporate SALT deduction Parity for capital gains and dividends section 899 revenge tax provision Tariffs Impacts of tariffs on consumer energy bills
WINNING STRATEGIES WASHINGTON,"PROLOGIS, L.P.",2nd Quarter - Report,30000.00,NA,2025,2025-07-15T13:08:27-04:00,https://lda.senate.gov/filings/public/filing/fd14dd05-07f7-4e20-8098-dc0098ae9958/print/,Government relations firm,"Real Estate, Warehousing and Logistics",Q2,second_quarter,"Reconciliation legislation, including provisions on renewable energy tax credits in general; direct pay conversion of energy credits; ITC and PTC extension and expansion (Secs. 48 and 45); and section 899 provisions"
ANCHOR GROUP LLC,STONEPEAK PARTNERS LP,2nd Quarter - Report,50000.00,NA,2025,2025-07-16T09:56:36-04:00,https://lda.senate.gov/filings/public/filing/b7e6b1e1-848b-45e5-afec-50c850d7981f/print/,NA,Infrastructure investment firm,Q2,second_quarter,"Advocating Congress to support policies aligned with investment in long-term, U.S.-based infrastructure, specifically about issues related to U.S. infrastructure investment and federal funding programs impacting private equity and institutional investors - including specifically tax credits and the Section 899 ""revenge tax"" in H.R. 1 (the One Big Beautiful Bill Act)"
INSTITUTE OF INTERNATIONAL BANKERS,INSTITUTE OF INTERNATIONAL BANKERS,2nd Quarter - Report,NA,230000.00,2025,2025-07-16T10:20:05-04:00,https://lda.senate.gov/filings/public/filing/8da0cdf8-3c03-4bf0-946e-9acdcfa010e5/print/,NA,NA,Q2,second_quarter,"- IRS Notice 2023-02 Excise Tax Stock Buyback; Changes to Section 163(n) of the Tax Code; CAMT. - Reconciliation - H.R.1, One Big Beautiful Bill Act, section 899"
NAIOP,NAIOP,2nd Quarter - Report,NA,341647.00,2025,2025-07-16T10:58:56-04:00,https://lda.senate.gov/filings/public/filing/7cfa61e2-d13b-4409-b2eb-b5e855c92198/print/,NA,NA,Q2,second_quarter,"Lobbied for passage of H.R.1, the One Big Beautiful Bill Act budget and tax reconciliation measure. Lobbied to make permanent 100% full expensing of business property (bonus depreciation). Lobbied to make permanent the IRS Section 199A 20% deduction for small and individually owned businesses. Lobbied to maintain the current deduction for businesses for payment of state and local taxes. Lobbied against retaliatory tax measures (Section 899) of the House-passed tax reconciliation measure. Lobbied to maintain current capital gains tax treatment for carried interest compensation. Lobbied to maintain IRS Code Section 1031 like-kind exchanges. Lobbied for an increase to the Low-Income Housing Tax Credit. Lobbied to extend deferred gain recognition date and other changes in the Opportunity Zones program. Lobbied for enactment of tax incentives to facilitate conversions of underutilized commercial buildings to affordable housing and mix-use developments (The Revitalizing Downtowns and Main Streets Act)."
"BROWNSTEIN HYATT FARBER SCHRECK, LLP",AMERICAN GAMING ASSOCIATION,2nd Quarter - Report,30000.00,NA,2025,2025-07-16T11:38:30-04:00,https://lda.senate.gov/filings/public/filing/5b276ae5-d62c-463a-8177-aeb0e4171f66/print/,Law firm,Represent members' common business issues in areas of federal govt. and legisl. relations,Q2,second_quarter,Introduce bill to amend the internal revenue code of 1986 to repeal the excise taxes on wagering Form W-2G reporting requirements
FGS GLOBAL (US) LLC (FKA FGH HOLDINGS LLC),"SIX CONTINENTS HOTELS, INC.",2nd Quarter - Report,50000.00,NA,2025,2025-07-16T12:07:35-04:00,https://lda.senate.gov/filings/public/filing/e2c1e949-fe66-4d1d-82d5-2df1fdf211b1/print/,Legislative and public affairs firm.,Hospitality,Q2,second_quarter,"Issues related to business tax provisions within the One Big Beautiful Bill Act (H.R.1)-including the extension of tax rates for passthrough entities, an extension of the Section 199A deduction, an increase in the cap for the Section 163 deduction, the extension of bonus depreciation, and the repeal of or changes to the proposed Section 899 tax."
"BROWNSTEIN HYATT FARBER SCHRECK, LLP","CAESARS ENTERPRISE SERVICES, LLC",2nd Quarter - Report,90000.00,NA,2025,2025-07-16T15:57:42-04:00,https://lda.senate.gov/filings/public/filing/2587ceb8-d66e-4699-9ab6-ec621c9cc219/print/,Law firm,Gaming,Q2,second_quarter,"""Issues relating to the gaming industry including taxation Reconciliation provision relating to new proposed new section 899 of the Tax Code"""
BASF CORPORATION,BASF CORPORATION,2nd Quarter - Report,NA,560000.00,2025,2025-07-16T23:03:10-04:00,https://lda.senate.gov/filings/public/filing/c2346648-a042-438c-8c06-d5c36fe97c4f/print/,NA,NA,Q2,second_quarter,"Expiration of P.L.115-97 (Tax Cut and Jobs Act (TCJA). BASF supports certainty in the business tax environment and a corporate tax rate that allows an appropriate return on investment, as well as immediate R&D expensing, a more flexible standard for interest deductibility, and full expensing of capital equipment purchases. Redrafting/Revising Renewable Chemical Act (previously H.R.6532/S.4931 in 118th session). BASF supports approaches that improve accessibility, usability, and recognition of mass balance accounting methodology. H.R.1 - One Big Beautiful Bill Act. BASF supports preservation of energy efficiency and other incentives enhanced by Inflation Reduction Act (P.L.117-169), including IRC Sec. 25C, Sec. 45L, Sec. 179D, Sec. 45X, and Sec. 45Z, and opposes the proposed IRC Sec. 899."
KEYCORP,KEYCORP,2nd Quarter - Report,NA,310000.00,2025,2025-07-17T08:46:27-04:00,https://lda.senate.gov/filings/public/filing/f9853b8b-4779-4634-80c6-6d5ac4ce2698/print/,Financial Services,NA,Q2,second_quarter,"General discussions related to Low Income Housing Tax Credit Discussions related to H.R. 1, One Big Beautiful Bill Act including provisions related to: - Investment Production Tax Credit, 48E - Low Income Housing Tax Credit - Interest Deductibility of Auto Loans - Sec 899, ""Enforcement Remedies Against Unfair Foreign Taxes"""
REAL ESTATE ROUNDTABLE,REAL ESTATE ROUNDTABLE,2nd Quarter - Report,NA,953313.00,2025,2025-07-17T11:49:26-04:00,https://lda.senate.gov/filings/public/filing/9dbfc48a-a11f-42ba-89b4-c4002dc9e295/print/,NA,NA,Q2,second_quarter,"""Carried Interest Fairness Act"" and carried interest reform, including changes in holding period Energy efficiency and clean energy tax incentives, including the E-QUIP Act and Inflation Reduction Act, and regulatory implementation Like-Kind Exchanges (Sec. 1031) Completed contract method of accounting and condominium construction (Section 460(e) Fair Accounting for Condominium Construction Act (HR 4280) FIRPTA reform and Parity for Non-Traded REITS Act Net investment income tax and SECA liability Cost recovery, residential rental property, nonresidential property, and bonus depreciation Low-income housing tax credit and the Affordable Housing Credit Improvement Act Proposed and final tax regulations under section 897 and 892 (FIRPTA domestically controlled REIT rules) REIT rules, including investments in related parties Retail Revitalization Act of 2023 (HR 3749, last Congress) Capital gains tax rate State and local tax deduction, including deductibility of state and local taxes on pass-through business income 20% deduction for pass-through business income (section 199A) and tax rules on pass-through income, including Senator Wyden pass-through reform discussion draft Opportunity Zone reform, reporting, and deadline extensions Revitalizing Downtowns Act and tax incentives for property conversions (HR 9002) Business interest deductibility and section 163(j) Active loss limitation and section 461(l)(Excess Business Losses) Treasury guidance: partnership basis-shifting transactions SECA limited partner exception under section 1402(a)(13) Deductibility of state and local business taxes, including property taxes (Business SALT) Immediate expensing of factories REIT-taxable REIT subsidiary asset test One Big Beautiful Bill Act (HR1) Retaliatory Tax Measures and Proposed Section 899 Tax treatment of loyalty point programs"
"MICHELIN NORTH AMERICA, INC.",MICHELIN NORTH AMERICA INC,2nd Quarter - Report,NA,227803.00,2025,2025-07-17T11:51:12-04:00,https://lda.senate.gov/filings/public/filing/692ac63d-30cf-4a21-aade-05f8c22a465f/print/,NA,Tire Manufacturer,Q2,second_quarter,"TCJA amendments to support annual tax deductions for research and development expenses, immediate business expensing, taxation of depreciation and amortization, retread truck tire credit, Sec. 899 of OBBB, OECD Pillar 1 and Pillar 2."
SECURITIES INDUSTRY AND FINANCIAL MARKETS ASSOCIATION,SECURITIES INDUSTRY AND FINANCIAL MARKETS ASSOCIATION,2nd Quarter - Report,NA,2060000.00,2025,2025-07-17T11:58:17-04:00,https://lda.senate.gov/filings/public/filing/a17a6626-c8c6-4c3a-a586-c6cd5fbc22e4/print/,NA,NA,Q2,second_quarter,"H.R. 684, Protecting American Savers and Retirees Act; H.R. 1013, Retirement Fairness for Charities and Educational Institutions Act of 2025; H.R. 1255, Investing in Our Communities Act; H.R. 2089, Generating Retirement Ownership through Long-Term Holding (GROWTH) Act; S. 424, Retirement Fairness for Charities and Educational Institutions Act of 2025; S. 1453, the LOCAL Infrastructure Act; IRS Stock Buyback Excise Tax; OECD BEPS 2.0 - an effort to address tax avoidance and ensure coherence of international tax rules; Issues related to 529 plans; Information Reporting and Withholding with respect to Bitcoin ETFs; Issues relating to the Global Intangible Low-Taxed Income framework; Reconciliation legislation related to provisions in the 2017 Tax Cuts and Jobs Act; Tax Treatment of Tokenized Securities; Issues related to energy credits under the Inflation Reduction Act; Executive compensation deductibility limits; Preservation of the Municipal Bond Tax Exemption; Reintroduction of the Local Infrastructure Act; Data privacy legislative proposals; Pub. L. No. 119-21 (One Big Beautiful Bill Act) issues relating to Section 899; Pub. L. No. 119-21 (One Big Beautiful Bill Act) issues relating to Pass Through Entity Tax; Pub. L. No. 119-21 (One Big Beautiful Bill Act) issues relating to excise tax on certain remittances."
"THE NICKLES GROUP, LLC","NOVO NORDISK, INC.",2nd Quarter - Report,80000.00,NA,2025,2025-07-17T12:31:43-04:00,https://lda.senate.gov/filings/public/filing/f43b1f87-4fa6-4b1e-bcd3-3d8a957b3638/print/,Consulting firm.,Pharmaceutical company.,Q2,second_quarter,"H.R. 1, One Big Beautiful Bill Act, as it relates to corporate taxes and foreign-based multinationals. H.R. 591, Defending American Jobs and Investment Act, and H.R. 2423, Unfair Tax Prevention Act, as they relate to multinational corporations."
AMERICAN SENIORS HOUSING ASSOCIATION,AMERICAN SENIORS HOUSING ASSOCIATION,2nd Quarter - Report,NA,75000.00,2025,2025-07-17T13:59:33-04:00,https://lda.senate.gov/filings/public/filing/04174c92-7a99-4bd1-9b42-b15acf4274cb/print/,seniors housing trade association,NA,Q2,second_quarter,"- H.R. 1177 - Improve and Enhance the Work Opportunity Tax Credit Act - H.R. 2410 - Revitalizing Downtowns and Main Streets Act - Incentivize Adaptive Reuse of Underutilized Commercial Properties - H.R. 2036 / S. 925 - Credit for Caring Act - H.R. 2082 - Well-Being Insurance for Seniors to be at Home (WISH) Act - H.R. 1321 - More Homes on the Market Act - Preservation of Carried Interest Tax Treatment - Preservation of Full Deductibility of Business-Related Property Taxes (B-SALT) - Section 199A of Internal Revenue Code - Deduction for Qualified Business Income (QBI) in Assisted Living Residence - H.R.1 - One Big Beautiful Bill Act - Section 899, Enforcement of Remedies Against Unfair Foreign Taxes of the House passed Budget Reconciliation bill to exempt non-controlling investments in U.S. real estate, regardless of whether those investments are made through equity or debt"
SUMITOMO CORPORATION OF AMERICAS,SUMITOMO CORPORATION OF AMERICAS,2nd Quarter - Report,NA,70000.00,2025,2025-07-17T14:16:45-04:00,https://lda.senate.gov/filings/public/filing/f16e0434-8429-4ce8-85d4-9c003350b206/print/,Integrated trading/investment related to various products/industries,NA,Q2,second_quarter,"Issues related to reconciliation, including Section 899."
"MIZUHO BANK, LTD.","MIZUHO BANK, LTD.",2nd Quarter - Report,NA,100000.00,2025,2025-07-17T14:37:34-04:00,https://lda.senate.gov/filings/public/filing/efacd6f9-8d17-4add-9b19-9879d3e038cf/print/,Financial Institution,NA,Q2,second_quarter,"HR 1, The One Big Beautiful Bill Act discussions regarding proposed Section 899."
